{
  "contract": "darwin-wrf-setups.acceptance-assessment/1",
  "id": "synthetic:unassessed",
  "synthetic": true,
  "dataset": {
    "id": "synthetic:dataset",
    "version": "1",
    "sha256": "7136b2416b4f8b59171a7aaa5cb6f799bb81f84c9f03a1fc3fd56e4e66bf3774"
  },
  "requirements": {
    "id": "synthetic:requirements",
    "revision": "1",
    "sha256": "2127bfd3ce7bf8e7eb24b173ac93c8aba640e31c364094be46875e1877d0e6b0"
  },
  "status": "unassessed",
  "evidence": [],
  "authority": null,
  "supersedes": null
}
