{
  "contract": "darwin-wrf-setups.acceptance-assessment/1",
  "id": "synthetic:accepted",
  "synthetic": true,
  "dataset": {
    "id": "synthetic:dataset",
    "version": "1",
    "sha256": "7136b2416b4f8b59171a7aaa5cb6f799bb81f84c9f03a1fc3fd56e4e66bf3774"
  },
  "requirements": {
    "id": "synthetic:requirements",
    "revision": "1",
    "sha256": "b5a7d3ea218154aacf3fb64ceafecc46ae171733038dd17d94becf39b47c1015"
  },
  "status": "accepted",
  "evidence": [
    {
      "criterion": "synthetic:criterion-a",
      "evidence_type": "synthetic:test-receipt",
      "artifact": {
        "id": "synthetic:receipt-a",
        "version": "1",
        "sha256": "32a903c2d5f4cdb24ab365eaf8b124b143468698eed35b50e2964c4dca7f6e9e"
      }
    },
    {
      "criterion": "synthetic:criterion-b",
      "evidence_type": "synthetic:test-receipt",
      "artifact": {
        "id": "synthetic:receipt-b",
        "version": "1",
        "sha256": "f184161fee0d82b1e92dbbb1d96a3bdeddfc8d5b60b0e090fb6a0800d4627d61"
      }
    }
  ],
  "authority": {
    "kind": "reviewer",
    "id": "synthetic:reviewer",
    "authorization": {
      "id": "synthetic:reviewer-authorization",
      "version": "1",
      "sha256": "44beb9be6083709be51762c04df8921acb1dad31dd947a99c6ec8db664cfe5ec"
    }
  },
  "supersedes": null
}
