{
  "contract": "darwin-wrf-setups.acceptance-assessment/1",
  "id": "synthetic:reassessment-accepted",
  "synthetic": true,
  "dataset": {
    "id": "synthetic:dataset",
    "version": "1",
    "sha256": "7136b2416b4f8b59171a7aaa5cb6f799bb81f84c9f03a1fc3fd56e4e66bf3774"
  },
  "requirements": {
    "id": "synthetic:requirements",
    "revision": "1",
    "sha256": "2127bfd3ce7bf8e7eb24b173ac93c8aba640e31c364094be46875e1877d0e6b0"
  },
  "status": "accepted",
  "evidence": [
    {
      "criterion": "synthetic:criterion-a",
      "evidence_type": "synthetic:test-receipt",
      "artifact": {
        "id": "synthetic:receipt-a-rerun",
        "version": "1",
        "sha256": "f3be9b2063efd3f1f67087d4e5439006ab6bea999282988e90268690ab45523c"
      }
    },
    {
      "criterion": "synthetic:criterion-a",
      "evidence_type": "synthetic:test-receipt",
      "artifact": {
        "id": "synthetic:receipt-a-rerun",
        "version": "2",
        "sha256": "d7705eba2e3d11d913cd46046d3a28cac047967f64923eaffd0f08cb8e717e56"
      }
    },
    {
      "criterion": "synthetic:criterion-b",
      "evidence_type": "synthetic:test-receipt",
      "artifact": {
        "id": "synthetic:receipt-b",
        "version": "1",
        "sha256": "f184161fee0d82b1e92dbbb1d96a3bdeddfc8d5b60b0e090fb6a0800d4627d61"
      }
    }
  ],
  "authority": {
    "kind": "reviewer",
    "id": "synthetic:reviewer",
    "authorization": {
      "id": "synthetic:reviewer-authorization",
      "version": "1",
      "sha256": "cee0320102a85f413142449bf86620f372c0ecb31d71bcb5251f5c5116d910b7"
    }
  },
  "supersedes": {
    "id": "synthetic:rejected",
    "sha256": "4ecc5bc358440c6fd06de05d9af9e7f47831162eab64c28b72cb9fd75fb58a9f"
  }
}
