{
  "authority": {
    "authorization": {
      "id": "synthetic:reviewer-authorization",
      "sha256": "cee0320102a85f413142449bf86620f372c0ecb31d71bcb5251f5c5116d910b7",
      "version": "1"
    },
    "id": "synthetic:reviewer",
    "kind": "reviewer"
  },
  "contract": "darwin-wrf-setups.acceptance-assessment/1",
  "dataset": {
    "id": "synthetic:prcp-slice",
    "sha256": "efebedd1b0fb36bdbd35d1a0f94b585b99e5b4c8fa0adf4d739183ccd372e90f",
    "version": "synthetic1.1"
  },
  "evidence": [
    {
      "artifact": {
        "id": "darwin-evidence:df35205c72d1ea91e215480cc31113894ae922228a4b6a1d90ea24d5dc0a93bb",
        "sha256": "e36424c0d73c075e7fc275c06253d44671e2422374d13b8729f0720b98bfd6f3",
        "version": "1"
      },
      "criterion": "synthetic:criterion-a",
      "evidence_type": "synthetic:test-receipt"
    },
    {
      "artifact": {
        "id": "darwin-evidence:caa1c2dc338e5e4f5d7da273f765e689ed7d58518b69b1d8ecdb921ce266676f",
        "sha256": "6bf58cf8d6d7f96ce6b260e24361a1fd12d9e3d3c8d7894b742d21fd691e1196",
        "version": "1"
      },
      "criterion": "synthetic:criterion-a",
      "evidence_type": "synthetic:test-receipt"
    },
    {
      "artifact": {
        "id": "darwin-evidence:4da29b51185486456803336e4770760b0f2363c32b3e194f4f28c51926cc3589",
        "sha256": "ce2af894f26b93af68b1a9040eb24d8b8aa6913d0bdbfc22452c59155066d878",
        "version": "1"
      },
      "criterion": "synthetic:criterion-b",
      "evidence_type": "synthetic:test-receipt"
    }
  ],
  "id": "synthetic:prcp-slice-assessment-2",
  "requirements": {
    "id": "synthetic:requirements",
    "revision": "1",
    "sha256": "ebd74747847471fa3997aad65621299194c9b8c2092c35adb96a4c8aae0dab50"
  },
  "status": "accepted",
  "supersedes": {
    "id": "synthetic:prcp-slice-assessment-1",
    "sha256": "63d95c9ef861748916928fffdcabf46e3502b41847c697371c8f931a6954214f"
  },
  "synthetic": true
}
